<!ELEMENT products (product+)>

    <!ELEMENT product (title, price, description?)>

    <!ELEMENT title (#PCDATA) >

    <!ELEMENT price (#PCDATA) >

    <!ELEMENT description (#PCDATA) >